"60836","*****","310M500US44780","Sturgis, MI Micro Area"
"36486","*****","310M500US44860","Sulphur Springs, TX Micro Area"
"24812","*****","310M500US44900","Summerville, GA Micro Area"
"140714","*****","310M500US44940","Sumter, SC Metro Area"
"91761","*****","310M500US44980","Sunbury, PA Micro Area"
"30818","*****","310M500US45000","Susanville, CA Micro Area"
"14904","*****","310M500US45020","Sweetwater, TX Micro Area"
"652416","*****","310M500US45060","Syracuse, NY Metro Area"
"48664","*****","310M500US45140","Tahlequah, OK Micro Area"
"80387","*****","310M500US45180","Talladega-Sylacauga, AL Micro Area"
"382197","*****","310M500US45220","Tallahassee, FL Metro Area"
"3097859","*****","310M500US45300","Tampa-St. Petersburg-Clearwater, FL Metro Area"
"32786","*****","310M500US45340","Taos, NM Micro Area"
"32931","*****","310M500US45380","Taylorville, IL Micro Area"
"186908","*****","310M500US45460","Terre Haute, IN Metro Area"
"149292","*****","310M500US45500","Texarkana, TX-AR Metro Area"
"26130","*****","310M500US45520","The Dalles, OR Micro Area"
"125044","*****","310M500US45540","The Villages, FL Metro Area"
"26236","*****","310M500US45580","Thomaston, GA Micro Area"
"44630","*****","310M500US45620","Thomasville, GA Micro Area"
"55351","*****","310M500US45660","Tiffin, OH Micro Area"
"40541","*****","310M500US45700","Tifton, GA Micro Area"
"25750","*****","310M500US45740","Toccoa, GA Micro Area"
"644137","*****","310M500US45780","Toledo, OH Metro Area"
"232778","*****","310M500US45820","Topeka, KS Metro Area"
"182002","*****","310M500US45860","Torrington, CT Micro Area"
"149033","*****","310M500US45900","Traverse City, MI Micro Area"
"367922","*****","310M500US45940","Trenton-Princeton, NJ Metro Area"
"33333","*****","310M500US45980","Troy, AL Micro Area"
"99244","*****","310M500US46020","Truckee-Grass Valley, CA Micro Area"
"1027207","*****","310M500US46060","Tucson, AZ Metro Area"
"103312","*****","310M500US46100","Tullahoma-Manchester, TN Micro Area"
"990544","*****","310M500US46140","Tulsa, OK Metro Area"
"165407","*****","310M500US46180","Tupelo, MS Micro Area"
"250681","*****","310M500US46220","Tuscaloosa, AL Metro Area"
"108599","*****","310M500US46300","Twin Falls, ID Metro Area"
"227449","*****","310M500US46340","Tyler, TX Metro Area"
"87224","*****","310M500US46380","Ukiah, CA Micro Area"
"27490","*****","310M500US46420","Union, SC Micro Area"
"30365","*****","310M500US46460","Union City, TN Micro Area"
"38845","*****","310M500US46500","Urbana, OH Micro Area"
"984821","*****","310M500US46520","Urban Honolulu, HI Metro Area"
"292016","*****","310M500US46540","Utica-Rome, NY Metro Area"
"26920","*****","310M500US46620","Uvalde, TX Micro Area"
"145315","*****","310M500US46660","Valdosta, GA Metro Area"
"441829","*****","310M500US46700","Vallejo, CA Metro Area"
"28261","*****","310M500US46780","Van Wert, OH Micro Area"
"13957","*****","310M500US46820","Vermillion, SD Micro Area"
"36084","*****","310M500US46860","Vernal, UT Micro Area"
"12833","*****","310M500US46900","Vernon, TX Micro Area"
"46519","*****","310M500US46980","Vicksburg, MS Micro Area"
"99674","*****","310M500US47020","Victoria, TX Metro Area"
"36030","*****","310M500US47080","Vidalia, GA Micro Area"
"37065","*****","310M500US47180","Vincennes, IN Micro Area"
"151906","*****","310M500US47220","Vineland-Bridgeton, NJ Metro Area"
"17312","*****","310M500US47240","Vineyard Haven, MA Micro Area"
"1761729","*****","310M500US47260","Virginia Beach-Norfolk-Newport News, VA-NC Metro Area"
"461898","*****","310M500US47300","Visalia, CA Metro Area"
"31389","*****","310M500US47340","Wabash, IN Micro Area"
"268361","*****","310M500US47380","Waco, TX Metro Area"
"22545","*****","310M500US47420","Wahpeton, ND-MN Micro Area"
"60365","*****","310M500US47460","Walla Walla, WA Metro Area"
"45729","*****","310M500US47540","Wapakoneta, OH Micro Area"
"180652","*****","310M500US47580","Warner Robins, GA Metro Area"
"39756","*****","310M500US47620","Warren, PA Micro Area"
"53682","*****","310M500US47660","Warrensburg, MO Micro Area"
"79035","*****","310M500US47700","Warsaw, IN Micro Area"
"33120","*****","310M500US47780","Washington, IN Micro Area"
"47168","*****","310M500US47820","Washington, NC Micro Area"
"6196585","*****","310M500US47900","Washington-Arlington-Alexandria, DC-VA-MD-WV Metro Area"
"28620","*****","310M500US47920","Washington Court House, OH Micro Area"
"169556","*****","310M500US47940","Waterloo-Cedar Falls, IA Metro Area"
"34051","*****","310M500US47980","Watertown, SD Micro Area"
"84701","*****","310M500US48020","Watertown-Fort Atkinson, WI Micro Area"
"112842","*****","310M500US48060","Watertown-Fort Drum, NY Metro Area"
"27131","*****","310M500US48100","Wauchula, FL Micro Area"
"163140","*****","310M500US48140","Wausau-Weston, WI Metro Area"
"54843","*****","310M500US48180","Waycross, GA Micro Area"
"29152","*****","310M500US48220","Weatherford, OK Micro Area"
"118213","*****","310M500US48260","Weirton-Steubenville, WV-OH Metro Area"
"118252","*****","310M500US48300","Wenatchee, WA Metro Area"
"40104","*****","310M500US48460","West Plains, MO Micro Area"
"19640","*****","310M500US48500","West Point, MS Micro Area"
"141475","*****","310M500US48540","Wheeling, WV-OH Metro Area"
"103074","*****","310M500US48580","Whitewater, WI Micro Area"
"637690","*****","310M500US48620","Wichita, KS Metro Area"
"150715","*****","310M500US48660","Wichita Falls, TX Metro Area"
"114330","*****","310M500US48700","Williamsport, PA Metro Area"
"35208","*****","310M500US48780","Williston, ND Micro Area"
"42841","*****","310M500US48820","Willmar, MN Micro Area"
"288337","*****","310M500US48900","Wilmington, NC Metro Area"
"41957","*****","310M500US48940","Wilmington, OH Micro Area"
"81435","*****","310M500US48980","Wilson, NC Micro Area"
"137621","*****","310M500US49020","Winchester, VA-WV Metro Area"
"35351","*****","310M500US49060","Winfield, KS Micro Area"
"16828","*****","310M500US49080","Winnemucca, NV Micro Area"
"50725","*****","310M500US49100","Winona, MN Micro Area"
"666216","*****","310M500US49180","Winston-Salem, NC Metro Area"
"73112","*****","310M500US49220","Wisconsin Rapids-Marshfield, WI Micro Area"
"24742","*****","310M500US49260","Woodward, OK Micro Area"
"116099","*****","310M500US49300","Wooster, OH Micro Area"
"941338","*****","310M500US49340","Worcester, MA-CT Metro Area"
"21734","*****","310M500US49380","Worthington, MN Micro Area"
"249697","*****","310M500US49420","Yakima, WA Metro Area"
"22717","*****","310M500US49460","Yankton, SD Micro Area"
"90618","*****","310M500US49500","Yauco, PR Metro Area"
"445565","*****","310M500US49620","York-Hanover, PA Metro Area"
"541846","*****","310M500US49660","Youngstown-Warren-Boardman, OH-PA Metro Area"
"172469","*****","310M500US49700","Yuba City, CA Metro Area"
"209468","*****","310M500US49740","Yuma, AZ Metro Area"
"86131","*****","310M500US49780","Zanesville, OH Micro Area"
"14304","*****","310M500US49820","Zapata, TX Micro Area"
